Topic,Difficulty,Question,Answer
Swings,Easy,What is Swing in Java?,"Swing is a set of GUI (Graphical User Interface) components and tools provided by Java's Swing framework, which allows developers to create rich, platform-independent graphical user interfaces for Java applications."
Swings,Easy,What is the difference between AWT and Swing in Java?,"AWT (Abstract Window Toolkit) is the original GUI framework in Java, while Swing is an extension of AWT that provides a more extensive set of components, improved look and feel, and enhanced functionality. Swing components are lightweight, providing a consistent user interface across different platforms, whereas AWT components are heavyweight and rely on the underlying operating system for rendering."
Swings,Easy,What is the purpose of a JComponent in Swing?,"JComponent is an abstract class in Swing that serves as the base class for all Swing components, providing common functionality such as painting, event handling, and component size management. It allows developers to create custom components by extending JComponent and overriding its methods."
Swings,Easy,What is a JPanel in Swing?,"JPanel is a container component in Swing that provides an area for organizing and grouping other components. It acts as a lightweight container that can hold other Swing components, such as buttons, labels, or text fields, and helps in laying out the components within its boundaries."
Swings,Easy,What is the use of setPreferredSize() method in Swing?,"The setPreferredSize() method in Swing is used to set the preferred size of a component, specifying the desired width and height. It provides a hint to the layout manager or parent container about the preferred dimensions of the component, helping in determining the appropriate size allocation for the component during layout calculations."
Swings,Easy,What is the purpose of the Container class in Swing?,"The Container class in Swing is a subclass of Component and serves as a base class for components that can contain other components. It provides methods for adding, removing, and managing child components, as well as layout-related functionality for arranging the child components within the container's area."
Swings,Easy,What is the purpose of the BoxLayout class in Swing?,"The BoxLayout class in Swing is a layout manager that arranges components in either a horizontal or vertical box-like arrangement. It allows components to be stacked or placed in a linear sequence, maintaining their preferred sizes and respecting constraints such as alignment or spacing."
Swings,Easy,How do you create a button in Swing?,"To create a button in Swing, you can instantiate the JButton class and optionally set its text, icon, action command, and event listeners. For example: JButton button = new JButton(""Click me"");"
Swings,Easy,How do you set the text of a JLabel in Swing?,"To set the text of a JLabel in Swing, you can use the setText() method of the JLabel class and pass the desired text as a parameter. For example: JLabel label = new JLabel(); label.setText(""Hello, World!"");"
Swings,Easy,How do you create a checkbox in Swing?,"To create a checkbox in Swing, you can instantiate the JCheckBox class and optionally set its text, initial selected state, and event listeners. For example: JCheckBox checkBox = new JCheckBox(""Check me"");"
Swings,Easy,How do you create a radio button in Swing?,"To create a radio button in Swing, you can instantiate the JRadioButton class and optionally set its text, initial selected state, and event listeners. Radio buttons are typically grouped together using ButtonGroup to ensure only one option is selected at a time. For example: JRadioButton radioButton = new JRadioButton(""Option 1"");"
Swings,Easy,What is the purpose of the BorderLayout in Swing?,"The BorderLayout in Swing is a layout manager that divides the container into five regions: North, South, East, West, and Center. It allows components to be placed and resized in these regions, providing a simple way to create a basic structure for arranging components."
Swings,Easy,What is the purpose of the GridLayout in Swing?,"The GridLayout in Swing is a layout manager that arranges components in a grid-like manner, with a specified number of rows and columns. It evenly divides the container's area to accommodate the components, resizing them if necessary, and maintaining their relative positions."
Swings,Easy,What is the purpose of the CardLayout in Swing?,"The CardLayout in Swing is a layout manager that allows multiple components to be stacked on top of each other, similar to a deck of cards. It provides methods to switch between components, allowing only one component to be visible at a time. CardLayout is often used for implementing multi-panel views or wizards where different screens need to be displayed."
Swings,Easy,What is the purpose of the JTable class in Swing?,"The JTable class in Swing is used to display tabular data in a grid-like format. It provides methods for creating and customizing tables, setting data models, defining column headers, handling sorting and selection, and incorporating editors and renderers for cell customization. JTable is a versatile component for representing structured data."
Swings,Easy,What is the purpose of the JList class in Swing?,"The JList class in Swing is used to display a list of items, allowing the user to select one or multiple items. It provides methods for creating and managing lists, setting list models, handling selection events, customizing the appearance and behavior, and supporting scrollable lists. JList is commonly used for presenting options or collections of data."
Swings,Easy,What is the purpose of the JComboBox class in Swing?,"The JComboBox class in Swing is a combination of a text field and a drop-down list, allowing the user to select an item from a list or enter custom text. It provides methods for managing the list of items, handling selection events, customizing the appearance, and incorporating renderers and editors for item rendering and editing. JComboBox is useful for selection-based input."
Swings,Easy,What is the purpose of the JMenuBar class in Swing?,"The JMenuBar class in Swing is used to create a horizontal menu bar that contains one or more JMenu components. It provides methods for adding and managing menus, handling menu events, customizing the appearance, and incorporating accelerators for keyboard shortcuts. JMenuBar is typically placed at the top of a window and allows access to various application functions."
Swings,Easy,What is the purpose of the JScrollPane class in Swing?,"The JScrollPane class in Swing is used to provide scrollable views for components that exceed the available space. It wraps a target component, such as a panel or text area, and provides scroll bars when necessary, enabling users to navigate the content. JScrollPane is commonly used for displaying large text, tables, or other components with dynamic or extensive content."
Swings,Medium,What is a layout manager in Swing?,"A layout manager in Swing is a class that is responsible for determining the size and position of components within a container. It automatically arranges the components based on specific rules and constraints, providing a flexible and dynamic way of managing the layout of GUI components."
Swings,Medium,What are the different types of layout managers in Swing?,"Swing provides several layout managers, including BorderLayout, FlowLayout, GridLayout, CardLayout, BoxLayout, GroupLayout, and SpringLayout. Each layout manager has its own rules and strategies for arranging components, allowing developers to choose the most appropriate one based on the desired layout structure and behavior."
Swings,Medium,How do you add components to a JFrame in Swing?,"To add components to a JFrame in Swing, you can use the JFrame's content pane. First, obtain the content pane of the JFrame using the getContentPane() method. Then, add components to the content pane using its add() method. For example: JFrame frame = new JFrame(); Container contentPane = frame.getContentPane(); contentPane.add(new JButton(""Click me""));"
Swings,Medium,How do you add components to a JPanel in Swing?,"To add components to a JPanel in Swing, you can use the JPanel's add() method. Simply call the add() method of the JPanel instance and pass the component you want to add as a parameter. For example: JPanel panel = new JPanel(); panel.add(new JLabel(""Hello, World!""));"
Swings,Medium,What is a JDialog in Swing?,"A JDialog in Swing is a top-level window that is typically used to create dialog boxes or secondary windows within an application. It extends the Dialog class and provides a modal or non-modal dialog that can display information, prompt for user input, or perform specific actions. JDialogs are often used for options, alerts, or custom user interactions."
Swings,Medium,What is the purpose of the JFileChooser class in Swing?,"The JFileChooser class in Swing provides a GUI component for file selection. It allows users to browse and select files or directories from the file system. JFileChooser provides a standard file dialog with features such as file filtering, file preview, and customization options. It simplifies the process of file handling and path selection in Swing applications."
Swings,Medium,What is the purpose of the JColorChooser class in Swing?,"The JColorChooser class in Swing is used to create a color selection dialog. It provides a GUI component that allows users to choose a color from a palette, specify color components, or enter color values. JColorChooser simplifies color selection and is often used in applications where color customization or color-related operations are required."
Swings,Medium,What is the purpose of the JProgressBar class in Swing?,"The JProgressBar class in Swing is used to display a progress bar, indicating the progress of a task or operation. It provides visual feedback to the user about the completion status or progress percentage of a lengthy task. JProgressBar is commonly used in applications where tasks with indeterminate or determinate progress need to be represented."
Swings,Medium,What is the purpose of the JSlider class in Swing?,"The JSlider class in Swing is used to create a slider component that allows users to select a value within a specified range. It provides a draggable thumb or knob that can be moved along a track to indicate a value. JSlider is often used for settings, volume controls, or any interactive element that requires continuous value selection or adjustment."
Swings,Medium,What is the purpose of the JTextArea class in Swing?,"The JTextArea class in Swing is used to create a multi-line text component that can display and allow editing of multiple lines of text. It provides methods for setting and retrieving text content, managing line wrapping, and customizing appearance and behavior. JTextArea is commonly used for text input, text display, or text editing purposes in Swing applications."
Swings,Medium,What is the purpose of the JTextField class in Swing?,"The JTextField class in Swing is used to create a single-line text input component. It allows users to enter and edit text in a single line. JTextField provides methods for setting and retrieving text content, handling user input events, and customizing appearance and behavior. It is widely used for text input fields, search boxes, or any single-line text entry in Swing applications."
Swings,Medium,How do you create a menu in Swing?,"To create a menu in Swing, you need to use a combination of classes such as JMenuBar, JMenu, and JMenuItem. First, create a JMenuBar instance, then create JMenu instances, and add them to the JMenuBar. Finally, create JMenuItem instances and add them to the JMenu. For example: JMenuBar menuBar = new JMenuBar(); JMenu fileMenu = new JMenu(""File""); JMenuItem openItem = new JMenuItem(""Open""); fileMenu.add(openItem); menuBar.add(fileMenu);"
Swings,Medium,How do you create a popup menu in Swing?,"To create a popup menu in Swing, you can use the JPopupMenu class. First, create an instance of JPopupMenu, then create instances of JMenuItem or other menu-related components, and add them to the JPopupMenu. Finally, attach the popup menu to a component using the addMouseListener() method and handle mouse events to display the popup menu at the desired location."
Swings,Medium,What is the purpose of the JOptionPane class in Swing?,"The JOptionPane class in Swing provides a simple way to display various types of standard dialog boxes, such as message dialogs, input dialogs, option dialogs, and confirmation dialogs. JOptionPane simplifies the process of showing dialog boxes by providing pre-built methods for different types of dialogs, allowing developers to quickly create informative and interactive messages."
Swings,Medium,What is the purpose of the JTabbedPane class in Swing?,The JTabbedPane class in Swing is used to create a tabbed pane component that organizes multiple components into tabs. It provides a tabbed interface where each tab represents a different content or functionality. JTabbedPane allows users to switch between tabs to view and interact with different components or views within a single container.
Swings,Medium,What is the purpose of the JSplitPane class in Swing?,"The JSplitPane class in Swing is used to create a split pane component that divides a container into two resizable areas separated by a draggable divider. It provides a way to adjust the size and position of the divided areas, allowing users to control the distribution of available space. JSplitPane is commonly used for creating resizable split views or adjustable panes."
Swings,Medium,What is the purpose of the JDesktopPane class in Swing?,"The JDesktopPane class in Swing is used to create a desktop-like container that allows internal frames to be displayed within it. It provides a workspace where multiple internal frames can be managed, overlapped, and moved. JDesktopPane is often used in applications that require a multi-window environment, such as document editors or multi-window interfaces."
Swings,Medium,What is the purpose of the JInternalFrame class in Swing?,The JInternalFrame class in Swing is used to create an internal frame component that represents a secondary window or view within a JDesktopPane. It provides a lightweight window that can be managed within a desktop-like container. JInternalFrame is commonly used in applications that require multiple independent windows or document-like views within a single parent frame.
Swings,Medium,How do you create a tooltip in Swing?,"To create a tooltip in Swing, you can use the setToolTipText() method of a component. Call the setToolTipText() method and pass the desired tooltip text as a parameter. When the user hovers the mouse cursor over the component, the tooltip will be displayed. For example: JButton button = new JButton(""Click me""); button.setToolTipText(""This is a tooltip"");"
Swings,Hard,What is the purpose of the JLayeredPane class in Swing?,"The JLayeredPane class in Swing is used to create a container that supports layering of components. It allows components to be added at different layers, enabling control over the stacking order of components."
Swings,Hard,What is the purpose of the GroupLayout class in Swing?,"The GroupLayout class in Swing is used to create and manage complex layouts. It provides a flexible and powerful way to arrange components in a container, supporting both horizontal and vertical grouping and alignment."
Swings,Hard,How do you use the GridBagLayout in Swing?,"To use the GridBagLayout in Swing, you create an instance of the GridBagLayout class and set it as the layout manager for a container. Then, you create GridBagConstraints objects to specify the layout constraints for each component, and add the components to the container using the add() method."
Swings,Hard,How do you customize the look and feel of a Swing application?,"To customize the look and feel of a Swing application, you can use the UIManager class to set various properties and styles. You can change the default look and feel, set custom colors, fonts, icons, and other visual aspects of the application. Additionally, you can use third-party look and feel libraries to achieve different visual themes."
Swings,Hard,What is the purpose of the UIManager class in Swing?,"The UIManager class in Swing is used to manage the look and feel of the user interface. It provides methods to set and retrieve properties related to the user interface, such as the default look and feel, fonts, colors, and other visual aspects."
Swings,Hard,What is the purpose of the LookAndFeel class in Swing?,The LookAndFeel class in Swing is used to define the look and feel of a Swing application. It provides a pluggable mechanism to change the appearance and behavior of Swing components by setting the look and feel class using the setLookAndFeel() method of the UIManager.
Swings,Hard,What is the purpose of the Border class in Swing?,"The Border class in Swing is used to define the visual border around a component. It allows you to add decorative elements, padding, and custom styling to components. Borders can be set using various border classes provided by Swing, or you can create custom border implementations."
Swings,Hard,What is the purpose of the BorderFactory class in Swing?,"The BorderFactory class in Swing is a utility class that provides methods for creating common border instances. It simplifies the process of creating borders by offering convenient factory methods for creating different types of borders, such as line borders, titled borders, etched borders, and more."
,,,
,,,
,,,
